Name,Price per Month,Commute Length,Commute Type,Link
"Dorchester Terrace, London","£2,700 pcm",1394,Transit,rightmove.co.uk/properties/163615766#/?channel=RES_LET
"Barclay Close, Cassidy Road, Fulham, London, SW6","£3,000 pcm",1503,Transit,rightmove.co.uk/properties/165663329#/?channel=RES_LET
"Prusom Street, London","£2,800 pcm",1594,Transit,rightmove.co.uk/properties/165021995#/?channel=RES_LET
"Lambrook Terrace, SW6","£2,500 pcm",1628,Transit,rightmove.co.uk/properties/166043369#/?channel=RES_LET
"Bruckner Street, London, W10","£2,799 pcm",1682,Transit,rightmove.co.uk/properties/164058587#/?channel=RES_LET
"Delorme Street, Hammersmith, London, W6","£2,900 pcm",1731,Transit,rightmove.co.uk/properties/162799031#/?channel=RES_LET
"Uxbridge Road, London, W12","£2,299 pcm",1769,Transit,rightmove.co.uk/properties/165807428#/?channel=RES_LET
"Churchill Gardens, London, SW1V","£2,648 pcm",1801,Transit,rightmove.co.uk/properties/166015484#/?channel=RES_LET
"Churchill Gardens, London, SW1V","£2,600 pcm",1808,Transit,rightmove.co.uk/properties/166015241#/?channel=RES_LET
"Churchill Gardens, London, SW1V","£2,687 pcm",1834,Transit,rightmove.co.uk/properties/165942626#/?channel=RES_LET
"Lulworth House, Stockwell, London, SW8","£2,650 pcm",1859,Transit,rightmove.co.uk/properties/163456184#/?channel=RES_LET
"Lancaster Court, 
Darlan Road, SW6","£3,000 pcm",1961,Transit,rightmove.co.uk/properties/166003847#/?channel=RES_LET
"Cassidy Road, Barclay Close, London, SW6","£3,000 pcm",1967,Transit,rightmove.co.uk/properties/163467641#/?channel=RES_LET
"Chiswick High Road, Chsiwick","£2,747 pcm",1975,Transit,rightmove.co.uk/properties/164153513#/?channel=RES_LET
"Fulham Road, Parsons Green, London, SW6","£2,817 pcm",2121,Transit,rightmove.co.uk/properties/164757773#/?channel=RES_LET
Lingfield House,"£2,847 pcm",2126,Transit,rightmove.co.uk/properties/163958411#/?channel=RES_LET
"Churchill Gardens, London, SW1V","£2,648 pcm",2135,Transit,rightmove.co.uk/properties/166015484#/?channel=RES_LET
"Law Street, London","£2,648 pcm",2198,Transit,rightmove.co.uk/properties/165013088#/?channel=RES_LET
"Edensor Gardens, Chiswick","£2,799 pcm",2210,Transit,rightmove.co.uk/properties/163433453#/?channel=RES_LET
"St Mary Le Park, Albert Bridge Road, Battersea SW11","£2,900 pcm",2228,Transit,rightmove.co.uk/properties/164351756#/?channel=RES_LET
"Strathan Close, London, SW18","£2,570 pcm",2240,Transit,rightmove.co.uk/properties/87241446#/?channel=RES_LET
"Otford House, 3 Bed Flat, SE1","£2,999 pcm",2255,Transit,rightmove.co.uk/properties/163432577#/?channel=RES_LET
"Morrish Road, Brixton Hill, London, SW2","£3,000 pcm",2268,Transit,rightmove.co.uk/properties/165066965#/?channel=RES_LET
"Henty Close, Battersea, SW11","£2,747 pcm",2270,Transit,rightmove.co.uk/properties/165493904#/?channel=RES_LET
"Fulham Palace Road, Fulham, London, SW6","£2,750 pcm",2280,Transit,rightmove.co.uk/properties/87214053#/?channel=RES_LET
"Dunraven Road, Shepherds Bush, London, W12","£2,950 pcm",2297,Transit,rightmove.co.uk/properties/145378016#/?channel=RES_LET
"Durnsford Road, Wimbledon Park, London, SW19","£2,700 pcm",2313,Transit,rightmove.co.uk/properties/165606998#/?channel=RES_LET
"Lansdowne Green, London","£2,800 pcm",2323,Transit,rightmove.co.uk/properties/165874757#/?channel=RES_LET
"Cloister Road, Acton, London, W3","£2,500 pcm",2327,Transit,rightmove.co.uk/properties/162552152#/?channel=RES_LET
"Hanford Close, London, SW18","£2,700 pcm",2337,Transit,rightmove.co.uk/properties/165538370#/?channel=RES_LET
"Aubyn Square, Putney","£2,650 pcm",2342,Transit,rightmove.co.uk/properties/163688003#/?channel=RES_LET
"Ballantrae House, London","£2,250 pcm",2346,Transit,rightmove.co.uk/properties/164946317#/?channel=RES_LET
"Shipwright Road, Southwark, SE16","£2,500 pcm",2379,Transit,rightmove.co.uk/properties/165207170#/?channel=RES_LET
"Bartholomew Street, Borough, London","£2,795 pcm",2384,Transit,rightmove.co.uk/properties/164800373#/?channel=RES_LET
"Ray Walk, Finsbury Park, London, N7","£3,000 pcm",2395,Transit,rightmove.co.uk/properties/165121301#/?channel=RES_LET
Mason House,"£2,847 pcm",2402,Transit,rightmove.co.uk/properties/163952978#/?channel=RES_LET
"Lant Street, London, SE1","£2,799 pcm",2402,Transit,rightmove.co.uk/properties/109146980#/?channel=RES_LET
"Gunnersbury Manor, Elm Avenue, London, W5","£2,550 pcm",2403,Transit,rightmove.co.uk/properties/165944534#/?channel=RES_LET
"22 Sturmer Way, London, N7","£2,950 pcm",2406,Transit,rightmove.co.uk/properties/165917558#/?channel=RES_LET
"Warwick Drive, Putney","£2,950 pcm",2410,Transit,rightmove.co.uk/properties/164419058#/?channel=RES_LET
"Loftus Road, London, W12","£3,000 pcm",2422,Transit,rightmove.co.uk/properties/165691241#/?channel=RES_LET
"Dudley Gardens, Ealing","£2,999 pcm",2448,Transit,rightmove.co.uk/properties/165058268#/?channel=RES_LET
"Battersea Park Road, Battersea, London, SW11","£2,850 pcm",2449,Transit,rightmove.co.uk/properties/165897566#/?channel=RES_LET
"Goldsborough House, Wandsworth Road, London, SW8","£3,000 pcm",2464,Transit,rightmove.co.uk/properties/165028523#/?channel=RES_LET
"Bravington Road, Maida Vale","£2,999 pcm",2464,Transit,rightmove.co.uk/properties/162865811#/?channel=RES_LET
Long Lane,"£2,847 pcm",2486,Transit,rightmove.co.uk/properties/165590558#/?channel=RES_LET
"Tabard Street, Bermondsey, London, SE1","£3,000 pcm",2489,Transit,rightmove.co.uk/properties/161948699#/?channel=RES_LET
"Blondin Way, London, SE16","£2,800 pcm",2498,Transit,rightmove.co.uk/properties/163556093#/?channel=RES_LET
"Heslop Road, Nightingale Triangle, London, SW12","£2,500 pcm",2500,Transit,rightmove.co.uk/properties/164853056#/?channel=RES_LET
"Balham Park Road, Balham","£3,000 pcm",2506,Transit,rightmove.co.uk/properties/165958919#/?channel=RES_LET
"Market Road, Caledonian Road","£2,800 pcm",2511,Transit,rightmove.co.uk/properties/165720098#/?channel=RES_LET
"First Avenue, Acton","£2,999 pcm",2512,Transit,rightmove.co.uk/properties/165341882#/?channel=RES_LET
"Rolls Road, London Bridge","£2,400 pcm",2527,Transit,rightmove.co.uk/properties/165962981#/?channel=RES_LET
"Cortis Road, London, SW15","£2,800 pcm",2528,Transit,rightmove.co.uk/properties/165616376#/?channel=RES_LET
"Saxon Drive, West Acton","£2,900 pcm",2555,Transit,rightmove.co.uk/properties/165197480#/?channel=RES_LET
"Brick Lane, Spitalfields, London. E1","£2,995 pcm",2565,Transit,rightmove.co.uk/properties/165301865#/?channel=RES_LET
"Lockwood House, Oval, London, SE11","£2,750 pcm",2576,Transit,rightmove.co.uk/properties/164185088#/?channel=RES_LET
"Lonsdale Road, Barnes, SW13","£2,500 pcm",2592,Transit,rightmove.co.uk/properties/164021528#/?channel=RES_LET
"Bathurst Gardens, Queens Park","£3,000 pcm",2601,Transit,rightmove.co.uk/properties/164032382#/?channel=RES_LET
"Cherry Orchard Road, Croydon, London, CR0","£2,441 pcm",2602,Transit,rightmove.co.uk/properties/165928538#/?channel=RES_LET
"Highlands Heath, Portsmouth Road, Putney, SW15","£2,900 pcm",2605,Transit,rightmove.co.uk/properties/165881822#/?channel=RES_LET
"Walk House, Mile End Road, Stepney E1","£2,900 pcm",2611,Transit,rightmove.co.uk/properties/165477218#/?channel=RES_LET
"Salford Road, Balham","£2,500 pcm",2613,Transit,rightmove.co.uk/properties/163464161#/?channel=RES_LET
"Croxley Road, London, W9","£3,000 pcm",2613,Transit,rightmove.co.uk/properties/162795410#/?channel=RES_LET
"Parkham Street, Battersea, SW11","£2,500 pcm",2614,Transit,rightmove.co.uk/properties/164827451#/?channel=RES_LET
"Sutherland Avenue, Little Venice","£2,950 pcm",2625,Transit,rightmove.co.uk/properties/165998150#/?channel=RES_LET
"Jacob Mansions, Umberston Street, Whitechapel, London","£3,000 pcm",2625,Transit,rightmove.co.uk/properties/155173502#/?channel=RES_LET
"Leghorn Road, Harlesden, London, NW10","£2,250 pcm",2639,Transit,rightmove.co.uk/properties/163584557#/?channel=RES_LET
"Goldsborough House, 
Wandsworth Road, SW8","£3,000 pcm",2644,Transit,rightmove.co.uk/properties/165557189#/?channel=RES_LET
Wandsworth Road Stockwell SW8,"£3,000 pcm",2644,Transit,rightmove.co.uk/properties/165800018#/?channel=RES_LET
"South Lambeth Road, London, SW8","£2,496 pcm",2644,Transit,rightmove.co.uk/properties/165471779#/?channel=RES_LET
"Mastmaker Road, Canary Wharf","£2,999 pcm",2648,Transit,rightmove.co.uk/properties/87253170#/?channel=RES_LET
"Buxton Street, London, E1","£2,999 pcm",2653,Transit,rightmove.co.uk/properties/59139845#/?channel=RES_LET
"Station Parade, Willesden Green","£2,550 pcm",2655,Transit,rightmove.co.uk/properties/165114890#/?channel=RES_LET
"Grove Hill Road, London, SE5","£2,800 pcm",2662,Transit,rightmove.co.uk/properties/138867182#/?channel=RES_LET
"Western Avenue, Acton","£2,700 pcm",2674,Transit,rightmove.co.uk/properties/164135945#/?channel=RES_LET
"Anne Boleyn House, Prusom Street, E1W","£2,600 pcm",2682,Transit,rightmove.co.uk/properties/165428600#/?channel=RES_LET
"St. Johns Estate, London","£2,700 pcm",2684,Transit,rightmove.co.uk/properties/165791351#/?channel=RES_LET
"All Souls Avenue, Kensal Rise","£2,496 pcm",2688,Transit,rightmove.co.uk/properties/164406077#/?channel=RES_LET
"Camden Road, Camden, London, NW1","£3,000 pcm",2690,Transit,rightmove.co.uk/properties/165022439#/?channel=RES_LET
